{"accounting":[{"host_total_usec":1210000,"job_cgroup_inode":3100001,"launcher_cgroup_inode":3100001,"session":"smoke-caller-s00","status":"PASS","trial_sum_usec":482000,"trials":2,"window_usec":905000},{"host_total_usec":1220000,"job_cgroup_inode":3100002,"launcher_cgroup_inode":3100002,"session":"smoke-caller-s01","status":"PASS","trial_sum_usec":485000,"trials":2,"window_usec":910000}],"admission":{"active_at_handshake":[0,0,0],"lock_held_ns":5000000000},"bench_profile_sha256":"b8daa9309aedf5de670c5f37dd5b6b1b550ef84ee7e676f881bfba248ab6fc70","case":"record-scan","case_version":1,"created_at":"2026-10-11T12:00:00+00:00","dataset":{"kind":"synthetic","rows":256,"seed":20261007,"sha256":null,"size":"small"},"envelope":{"cpus":4,"cpuset":[0,1,2,3],"multicore":"PASS","reduced":false,"smt_siblings":[]},"evidence":{"jobs":[],"observations":"observations.jsonl","phases":"phases.jsonl"},"evidence_digests":{"observations.jsonl":"cfa2656c5d2261becaa15316de93a117de1cce63eec9bcca1e713624e91c2d50","phases.jsonl":"e3b0c44298fc1c149afbf4c8996fb92427ae41e4649b934ca495991b7852b855","plan.json":"38c5c9de0751db4a95f84a50d601d1bec0778e8629d1b071d476d0d7bc6fbbff"},"fixtures_sha256":"1257a7f160f217d66671b77c67a465c4589fe16be60eb868895aaa927ff46d0c","image_id":"sha256:40eabdd3da5e1ca993abec5d88388793352027f7b0a6e83b00ab6fea7bf32945","mode":"smoke","plan":{"estimate_seconds":12.0,"plan_id":"5f1c0de0000000000000000000000016","plan_version":"v1","project_dir":null,"project_identity":null,"seed":20261011},"policy_sha256":"34231485c6bfa7ca922381ed560e8708da11e763a06a4da83284879de3a03521","reasons":[],"run_id":"00000000000000000000000000000000","runtime":{"pool_start_method":"spawn","python":"3.13.5"},"schema_version":1,"source_identity":"aaaaaaaaaaaaaaaaaaaaaaaaaaaaaaaaaaaaaaaaaaaaaaaaaaaaaaaaaaaaaaaa","status":"VALID"}
